{
  "$schema": "../schemas/profile.schema.json",
  "schema_version": 1,
  "name": "pumpd-project",
  "description": "Committed configuration required for reliable PUMPD work in local and cloud agents.",
  "variables": {
    "project_root": "~/ws/PUMPD-MOBILE-APP/pumpd-mobile-app"
  },
  "checks": [
    {
      "id": "pumpd.agents-file",
      "kind": "path",
      "path": "${project_root}/AGENTS.md",
      "path_type": "file",
      "expected": "present"
    },
    {
      "id": "pumpd.claude-wrapper",
      "kind": "path",
      "path": "${project_root}/CLAUDE.md",
      "path_type": "file",
      "expected": "present"
    },
    {
      "id": "pumpd.claude-settings",
      "kind": "path",
      "path": "${project_root}/.claude/settings.json",
      "path_type": "file",
      "expected": "present"
    },
    {
      "id": "pumpd.claude-mcp-file",
      "kind": "path",
      "path": "${project_root}/.mcp.json",
      "path_type": "file",
      "expected": "present"
    },
    {
      "id": "pumpd.codex-config",
      "kind": "path",
      "path": "${project_root}/.codex/config.toml",
      "path_type": "file",
      "expected": "present"
    },
    {
      "id": "pumpd.codex-hooks",
      "kind": "path",
      "path": "${project_root}/.codex/hooks.json",
      "path_type": "file",
      "expected": "present"
    },
    {
      "id": "pumpd.backend-review-claude",
      "kind": "path",
      "path": "${project_root}/.claude/skills/backend-review/SKILL.md",
      "path_type": "file",
      "expected": "present"
    },
    {
      "id": "pumpd.backend-review-codex",
      "kind": "path",
      "path": "${project_root}/.agents/skills/backend-review/SKILL.md",
      "path_type": "file",
      "expected": "present"
    },
    {
      "id": "pumpd.fix-review-claude",
      "kind": "path",
      "path": "${project_root}/.claude/skills/fix-review/SKILL.md",
      "path_type": "file",
      "expected": "present"
    },
    {
      "id": "pumpd.fix-review-codex",
      "kind": "path",
      "path": "${project_root}/.agents/skills/fix-review/SKILL.md",
      "path_type": "file",
      "expected": "present"
    },
    {
      "id": "pumpd.backend-review-parity",
      "kind": "same_file",
      "paths": [
        "${project_root}/.claude/skills/backend-review/SKILL.md",
        "${project_root}/.agents/skills/backend-review/SKILL.md"
      ],
      "severity": "warning"
    },
    {
      "id": "pumpd.fix-review-parity",
      "kind": "same_file",
      "paths": [
        "${project_root}/.claude/skills/fix-review/SKILL.md",
        "${project_root}/.agents/skills/fix-review/SKILL.md"
      ],
      "severity": "warning"
    },
    {
      "id": "pumpd.architecture-canonical",
      "kind": "path",
      "path": "${project_root}/.agents/skills/pumpd-architecture/SKILL.md",
      "path_type": "file",
      "expected": "present"
    },
    {
      "id": "pumpd.architecture-claude",
      "kind": "path",
      "path": "${project_root}/.claude/skills/pumpd-architecture/SKILL.md",
      "path_type": "file",
      "expected": "present"
    },
    {
      "id": "pumpd.ui-patterns-canonical",
      "kind": "path",
      "path": "${project_root}/.agents/skills/pumpd-ui-patterns/SKILL.md",
      "path_type": "file",
      "expected": "present"
    },
    {
      "id": "pumpd.ui-patterns-claude",
      "kind": "path",
      "path": "${project_root}/.claude/skills/pumpd-ui-patterns/SKILL.md",
      "path_type": "file",
      "expected": "present"
    },
    {
      "id": "pumpd.testing-canonical",
      "kind": "path",
      "path": "${project_root}/.agents/skills/pumpd-testing/SKILL.md",
      "path_type": "file",
      "expected": "present"
    },
    {
      "id": "pumpd.testing-claude",
      "kind": "path",
      "path": "${project_root}/.claude/skills/pumpd-testing/SKILL.md",
      "path_type": "file",
      "expected": "present"
    },
    {
      "id": "pumpd.supabase-patterns-canonical",
      "kind": "path",
      "path": "${project_root}/.agents/skills/pumpd-supabase-patterns/SKILL.md",
      "path_type": "file",
      "expected": "present"
    },
    {
      "id": "pumpd.supabase-patterns-claude",
      "kind": "path",
      "path": "${project_root}/.claude/skills/pumpd-supabase-patterns/SKILL.md",
      "path_type": "file",
      "expected": "present"
    },
    {
      "id": "pumpd.quality-canonical",
      "kind": "path",
      "path": "${project_root}/.agents/skills/quality/SKILL.md",
      "path_type": "file",
      "expected": "present"
    },
    {
      "id": "pumpd.quality-claude",
      "kind": "path",
      "path": "${project_root}/.claude/skills/quality/SKILL.md",
      "path_type": "file",
      "expected": "present"
    },
    {
      "id": "pumpd.sync-types-canonical",
      "kind": "path",
      "path": "${project_root}/.agents/skills/sync-types/SKILL.md",
      "path_type": "file",
      "expected": "present"
    },
    {
      "id": "pumpd.sync-types-claude",
      "kind": "path",
      "path": "${project_root}/.claude/skills/sync-types/SKILL.md",
      "path_type": "file",
      "expected": "present"
    },
    {
      "id": "pumpd.ios-simulator-skill-canonical",
      "kind": "path",
      "path": "${project_root}/.agents/skills/pumpd-ios-simulator/SKILL.md",
      "path_type": "file",
      "expected": "present"
    },
    {
      "id": "pumpd.ios-simulator-skill-claude",
      "kind": "path",
      "path": "${project_root}/.claude/skills/pumpd-ios-simulator/SKILL.md",
      "path_type": "file",
      "expected": "present"
    },
    {
      "id": "pumpd.claude-supabase-local",
      "kind": "project_claude_mcp",
      "path": "${project_root}/.mcp.json",
      "server": "supabase_local",
      "expected": "present"
    },
    {
      "id": "pumpd.codex-context7",
      "kind": "project_codex_mcp",
      "path": "${project_root}/.codex/config.toml",
      "server": "context7",
      "expected": "present"
    },
    {
      "id": "pumpd.duplicate-claude-heroui-native",
      "kind": "project_claude_mcp",
      "path": "${project_root}/.mcp.json",
      "server": "heroui-native",
      "expected": "absent",
      "severity": "warning"
    },
    {
      "id": "pumpd.duplicate-claude-ios-simulator",
      "kind": "project_claude_mcp",
      "path": "${project_root}/.mcp.json",
      "server": "ios-simulator-mcp",
      "expected": "absent",
      "severity": "warning"
    },
    {
      "id": "pumpd.duplicate-codex-heroui-native",
      "kind": "project_codex_mcp",
      "path": "${project_root}/.codex/config.toml",
      "server": "heroui-native",
      "expected": "absent",
      "severity": "warning"
    },
    {
      "id": "pumpd.duplicate-codex-ios-simulator",
      "kind": "project_codex_mcp",
      "path": "${project_root}/.codex/config.toml",
      "server": "ios-simulator-mcp",
      "expected": "absent",
      "severity": "warning"
    }
  ],
  "manual_checks": [
    {
      "id": "pumpd.claude-cloud-canary",
      "description": "Verify project skills and MCPs from a merged revision in Claude Code cloud and Cyrus.",
      "last_verified": null
    },
    {
      "id": "pumpd.codex-cloud-canary",
      "description": "Verify project instructions, skills, and MCPs from a merged revision in Codex cloud.",
      "last_verified": null
    }
  ]
}
