{
  "$schema": "../schemas/profile.schema.json",
  "schema_version": 1,
  "name": "wet-in-seattle-workstation",
  "description": "Desired local tooling for It's Always Wet In Seattle reporting and operations.",
  "extends": [
    "base-workstation.json"
  ],
  "variables": {
    "project_root": "~/ws/IAWIS-Repo/always-wet-store"
  },
  "checks": [
    {
      "id": "claude.wet-in-seattle-plugin",
      "kind": "claude_plugin",
      "plugin": "wet-in-seattle@agent-tooling",
      "path": "${project_root}/.claude/settings.json",
      "expected": "enabled"
    },
    {
      "id": "codex.wet-in-seattle-plugin",
      "kind": "codex_plugin",
      "plugin": "wet-in-seattle@agent-tooling",
      "expected": "enabled"
    }
  ],
  "manual_checks": [
    {
      "id": "wet-in-seattle.analytics-health",
      "description": "Verify Doppler agent-tooling/prd access, analytics-mcp startup, and read access to the IAWIS GA4 property in each client.",
      "last_verified": null
    },
    {
      "id": "wet-in-seattle.shopify-cross-check",
      "description": "Verify the storefront checkout and Shopify cross-check credentials are available without committing them to agent-tooling.",
      "last_verified": null
    }
  ]
}
